{
  "contractVersion": "2.0",
  "policyRevision": 2,
  "currentWriter": {
    "appVersion": "0.5.5",
    "workspaceManifestFormat": 3,
    "snapshotPackageFormat": 2,
    "internalSnapshotManifestFormat": 2
  },
  "writerCompatibility": {
    "window": "current-and-one-previous-formal-release",
    "verificationGate": "disabled-until-packaged-runtime-evidence",
    "nMinusOneTarget": "0.5.0",
    "accepted": [
      {
        "appVersion": "0.5.5",
        "status": "current"
      }
    ],
    "pending": [
      {
        "appVersion": "0.5.0",
        "status": "pending",
        "compatibility": "unverified"
      }
    ]
  },
  "workspaceManifest": {
    "supportedFormat": 3,
    "topologySchemaVersion": 1,
    "businessSchemaVersion": 1,
    "olderFormatDisposition": "reject-zero-write-no-automatic-migration",
    "newerFormatDisposition": "reject-newer-zero-write"
  },
  "snapshotPackage": {
    "currentFormat": 2,
    "minimumSupportedFormat": 2,
    "unsupportedFormatDisposition": "reject-zero-write"
  },
  "compatibilityCorpus": {
    "mutationPolicy": "append-only",
    "immutablePrefix": {
      "anchorCommit": "9be3e4ce584709765322434fe9c9068ee6f84287",
      "path": "contracts/v2/compatibility-corpus.json",
      "baselineCount": 1,
      "formalReleaseCount": 1
    }
  }
}
